,symbol,name,area,industry,fullname,enname,cnspell,market,exchange,list_status,list_date,delist_date
1403,002921,联诚精密,山东,汽车配件,山东联诚精密制造股份有限公司,"Shandong Liancheng Precision Manufacturing Co., Ltd",lcjm,主板,SZSE,L,20171227,
1404,002922,伊戈尔,广东,电气设备,伊戈尔电气股份有限公司,"Eaglerise Electric & Electronic (China) Co., Ltd",yge,主板,SZSE,L,20171229,
1405,002923,润都股份,广东,化学制药,珠海润都制药股份有限公司,"Zhuhai Rundu Pharmaceutical Co., Ltd.",rdgf,主板,SZSE,L,20180105,
1406,002925,盈趣科技,福建,元器件,厦门盈趣科技股份有限公司,Xiamen Intretech Inc.,yqkj,主板,SZSE,L,20180115,
1407,002926,华西证券,四川,证券,华西证券股份有限公司,"Huaxi Securities Co.,Ltd.",hxzq,主板,SZSE,L,20180205,
1408,002927,泰永长征,贵州,电气设备,贵州泰永长征技术股份有限公司,"Guizhou Taiyong-Changzheng Technology Co.,Ltd.",tycz,主板,SZSE,L,20180223,
1409,002928,华夏航空,贵州,空运,华夏航空股份有限公司,"China Express Airlines Co.,LTD",hxhk,主板,SZSE,L,20180302,
1410,002929,润建股份,广西,通信设备,润建股份有限公司,"Runjian Co., Ltd.",rjgf,主板,SZSE,L,20180301,
1411,002930,宏川智慧,广东,仓储物流,广东宏川智慧物流股份有限公司,"Guangdong Great River Smarter Logistics Co.,Ltd",hczh,主板,SZSE,L,20180328,
1412,002931,锋龙股份,浙江,机械基件,浙江锋龙电气股份有限公司,"Zhejiang Fenglong Electric Co.,Ltd.",flgf,主板,SZSE,L,20180403,
1413,002932,明德生物,湖北,医疗保健,武汉明德生物科技股份有限公司,"Wuhan Easy Diagnosis Biomedicine Co.,Ltd.",mdsw,主板,SZSE,L,20180710,
1414,002933,新兴装备,北京,航空,北京新兴东方航空装备股份有限公司,"Beijing Emerging Eastern Aviation Equipment Co., Ltd.",xxzb,主板,SZSE,L,20180828,
1415,002935,天奥电子,四川,航空,成都天奥电子股份有限公司,"Chengdu Spaceon Electronics Co., Ltd.",tadz,主板,SZSE,L,20180903,
1416,002936,郑州银行,河南,银行,郑州银行股份有限公司,"Bank of Zhengzhou Co.,Ltd.",zzyh,主板,SZSE,L,20180919,
1417,002937,兴瑞科技,浙江,元器件,宁波兴瑞电子科技股份有限公司,"Ningbo Sunrise Elc Technology Co.,Ltd",xrkj,主板,SZSE,L,20180926,
1418,002938,鹏鼎控股,深圳,元器件,鹏鼎控股(深圳)股份有限公司,"Avary Holding (Shenzhen) Co., Limited",pdkg,主板,SZSE,L,20180918,
1419,002939,长城证券,深圳,证券,长城证券股份有限公司,"China Great Wall Securities Co.,Ltd.",cczq,主板,SZSE,L,20181026,
1420,002940,昂利康,浙江,化学制药,浙江昂利康制药股份有限公司,"Zhejiang Anglikang Pharmaceutical Co.,Ltd.",alk,主板,SZSE,L,20181023,
1421,002941,新疆交建,新疆,建筑工程,新疆交通建设集团股份有限公司,"Xinjiang Communications Construction Group Co.,Ltd.",xjjj,主板,SZSE,L,20181128,
1422,002942,新农股份,浙江,农药化肥,浙江新农化工股份有限公司,"Zhejiang Xinnong Chemical Co.,Ltd.",xngf,主板,SZSE,L,20181205,
1423,002943,宇晶股份,湖南,机床制造,湖南宇晶机器股份有限公司,"Hunan Yujing Machinery Co., Ltd",yjgf,主板,SZSE,L,20181129,
1424,002945,华林证券,西藏,证券,华林证券股份有限公司,"Chinalin Securities Co.,Ltd.",hlzq,主板,SZSE,L,20190117,
1425,002946,新乳业,四川,乳制品,新希望乳业股份有限公司,"New Hope Dairy Co., Ltd.",xry,主板,SZSE,L,20190125,
1426,002947,恒铭达,江苏,元器件,苏州恒铭达电子科技股份有限公司,"Suzhou Hengmingda Electronic Technology Co., Ltd.",hmd,主板,SZSE,L,20190201,
1427,002948,青岛银行,山东,银行,青岛银行股份有限公司,"Bank of Qingdao Co.,Ltd.",qdyh,主板,SZSE,L,20190116,
1428,002949,华阳国际,深圳,建筑工程,深圳市华阳国际工程设计股份有限公司,"Shenzhen Capol International & Associates Co.,Ltd",hygj,主板,SZSE,L,20190226,
1429,002950,奥美医疗,湖北,医疗保健,奥美医疗用品股份有限公司,"Allmed Medical Products Co.,Ltd",amyl,主板,SZSE,L,20190311,
1430,002951,金时科技,四川,广告包装,四川金时科技股份有限公司,"Sichuan Jinshi Technology Co.,Ltd",jskj,主板,SZSE,L,20190315,
1431,002952,亚世光电,辽宁,元器件,亚世光电(集团)股份有限公司,"Yes Optoelectronics (Group) Co., Ltd.",ysgd,主板,SZSE,L,20190328,
1432,002953,日丰股份,广东,电气设备,广东日丰电缆股份有限公司,"Guangdong Rifeng Electric Cable Co., Ltd.",rfgf,主板,SZSE,L,20190509,
1433,002955,鸿合科技,深圳,IT设备,鸿合科技股份有限公司,"Hitevision Co., Ltd.",hhkj,主板,SZSE,L,20190523,
1434,002956,西麦食品,广西,食品,桂林西麦食品股份有限公司,"Guilin Seamild Foods Co., Ltd",xmsp,主板,SZSE,L,20190619,
1435,002957,科瑞技术,深圳,专用机械,深圳科瑞技术股份有限公司,"Shenzhen Colibri Technologies Co.,Ltd.",krjs,主板,SZSE,L,20190726,
1436,002958,青农商行,山东,银行,青岛农村商业银行股份有限公司,Qingdao Rural Commercial Bank Corporation,qnsh,主板,SZSE,L,20190326,
1437,002959,小熊电器,广东,家用电器,小熊电器股份有限公司,"Bear Electric Appliance Co.,Ltd.",xxdq,主板,SZSE,L,20190823,
1438,002960,青鸟消防,河北,专用机械,青鸟消防股份有限公司,"Jade Bird Fire Co., Ltd.",qnxf,主板,SZSE,L,20190809,
1439,002961,瑞达期货,福建,多元金融,瑞达期货股份有限公司,"Ruida Futures Co.,Ltd.",rdqh,主板,SZSE,L,20190905,
1440,002962,五方光电,湖北,元器件,湖北五方光电股份有限公司,"Hubei W-Olf Photoelectric Technology Co.,Ltd.",wfgd,主板,SZSE,L,20190917,
1441,002963,豪尔赛,北京,装修装饰,豪尔赛科技集团股份有限公司,"Hes Technology Group Co., Ltd.",hes,主板,SZSE,L,20191028,
1442,002965,祥鑫科技,广东,汽车配件,祥鑫科技股份有限公司,"Lucky Harvest Co.,Ltd.",xxkj,主板,SZSE,L,20191025,
1443,002966,苏州银行,江苏,银行,苏州银行股份有限公司,"Bank of Suzhou Co.,Ltd",szyh,主板,SZSE,L,20190802,
1444,002967,广电计量,广东,电器仪表,广电计量检测集团股份有限公司,"Grg Metrology & Test Group Co., Ltd.",gdjl,主板,SZSE,L,20191108,
1445,002968,新大正,重庆,房产服务,新大正物业集团股份有限公司,"New Dazheng Property Group Co., Ltd",xdz,主板,SZSE,L,20191203,
1446,002969,嘉美包装,安徽,广告包装,嘉美食品包装(滁州)股份有限公司,"Jiamei Food Packaging (Chuzhou) Co.,Ltd",jmbz,主板,SZSE,L,20191202,
1447,002970,锐明技术,深圳,IT设备,深圳市锐明技术股份有限公司,"Streamax Technology Co., Ltd.",rmjs,主板,SZSE,L,20191217,
1448,002971,和远气体,湖北,化工原料,湖北和远气体股份有限公司,"Hubei Heyuan Gas Co.,Ltd.",hyqt,主板,SZSE,L,20200113,
1449,002972,科安达,深圳,运输设备,深圳科安达电子科技股份有限公司,"Shenzhen Keanda Electronic Technology Corp., Ltd.",kad,主板,SZSE,L,20191227,
1450,002973,侨银股份,广东,环境保护,侨银城市管理股份有限公司,"Qiaoyin City Management Co., Ltd.",qygf,主板,SZSE,L,20200106,
1451,002975,博杰股份,广东,专用机械,珠海博杰电子股份有限公司,"Zhuhai Bojay Electronics Co.,Ltd.",bjgf,主板,SZSE,L,20200205,
1452,002976,瑞玛精密,江苏,汽车配件,苏州瑞玛精密工业股份有限公司,"Suzhou Cheersson Precision Metal Forming Co., Ltd.",rmjm,主板,SZSE,L,20200306,
1453,002977,天箭科技,四川,通信设备,成都天箭科技股份有限公司,"Chengdu Tianjian Technology Co.,Ltd.",tjkj,主板,SZSE,L,20200317,
1454,002978,安宁股份,四川,小金属,四川安宁铁钛股份有限公司,"Sichuan Anning Iron and Titanium Co.,Ltd.",angf,主板,SZSE,L,20200417,
1455,002979,雷赛智能,深圳,专用机械,深圳市雷赛智能控制股份有限公司,"China Leadshine Technology Co., Ltd",lszn,主板,SZSE,L,20200408,
1456,002980,华盛昌,深圳,电器仪表,深圳市华盛昌科技实业股份有限公司,"Shenzhen Everbest Machinery Industry Co., Ltd.",hsc,主板,SZSE,L,20200415,
1457,002981,朝阳科技,广东,元器件,广东朝阳电子科技股份有限公司,Risuntek Inc.,zykj,主板,SZSE,L,20200417,
1458,002982,湘佳股份,湖南,农业综合,湖南湘佳牧业股份有限公司,"Hunan Xiangjia Animal Husbandry Co., Ltd",xjgf,主板,SZSE,L,20200424,
1459,002983,芯瑞达,安徽,元器件,安徽芯瑞达科技股份有限公司,"Anhui Coreach Technology Co.,Ltd",xrd,主板,SZSE,L,20200428,
1460,002984,森麒麟,山东,汽车配件,青岛森麒麟轮胎股份有限公司,"Qingdao Sentury Tire Co.,Ltd.",sql,主板,SZSE,L,20200911,
1461,002985,北摩高科,北京,航空,北京北摩高科摩擦材料股份有限公司,"Beijing Beimo High-Tech Frictional Material Co.,Ltd",bmgk,主板,SZSE,L,20200429,
1462,002986,宇新股份,湖南,化工原料,湖南宇新能源科技股份有限公司,"Hunan Yussen Energy Technology Co.,Ltd.",yxgf,主板,SZSE,L,20200602,
1463,002987,京北方,北京,软件服务,京北方信息技术股份有限公司,"Northking Information Technology Co.,Ltd.",jbf,主板,SZSE,L,20200507,
1464,002988,豪美新材,广东,铝,广东豪美新材股份有限公司,"Guangdong Haomei New Materials Co.,Ltd",hmxc,主板,SZSE,L,20200518,
1465,002989,中天精装,深圳,装修装饰,深圳中天精装股份有限公司,"Shenzhen Strongteam Decoration Engineering Co.,Ltd.",ztjz,主板,SZSE,L,20200610,
1466,002990,盛视科技,深圳,软件服务,盛视科技股份有限公司,Maxvision Technology Corp.,sskj,主板,SZSE,L,20200525,
1467,002991,甘源食品,江西,食品,甘源食品股份有限公司,"Ganyuan Foods Co., Ltd.",gysp,主板,SZSE,L,20200731,
1468,002992,宝明科技,深圳,元器件,深圳市宝明科技股份有限公司,"Shenzhen Baoming Technology Co.,Ltd",bmkj,主板,SZSE,L,20200803,
1469,002993,奥海科技,广东,元器件,东莞市奥海科技股份有限公司,"Dongguan Aohai Technology Co., Ltd.",ahkj,主板,SZSE,L,20200817,
1470,002995,天地在线,北京,互联网,北京全时天地在线网络信息股份有限公司,"Beijing Quanshi World Online Network Information Co., Ltd.",tdzx,主板,SZSE,L,20200805,
1471,002996,顺博合金,重庆,铝,重庆顺博铝合金股份有限公司,"Chongqing Shunbo Aluminum Co.,Ltd.",sbhj,主板,SZSE,L,20200828,
1472,002997,瑞鹄模具,安徽,专用机械,瑞鹄汽车模具股份有限公司,"Rayhoo Motor Dies Co.,Ltd.",rhmj,主板,SZSE,L,20200903,
1473,002998,优彩资源,江苏,化纤,优彩环保资源科技股份有限公司,"Elite Color Environmental Resources Science&Technology Co., Ltd",yczy,主板,SZSE,L,20200925,
1474,002999,天禾股份,广东,批发业,广东天禾农资股份有限公司,"Guangdong Tianhe Agricultural Means of Production Co.,Ltd.",thgf,主板,SZSE,L,20200903,
1475,003000,劲仔食品,湖南,食品,劲仔食品集团股份有限公司,"Jinzai Food Group Co.,Ltd.",jzsp,主板,SZSE,L,20200914,
1476,003001,中岩大地,北京,建筑工程,北京中岩大地科技股份有限公司,"Zhongyan Technology Co., Ltd.",zydd,主板,SZSE,L,20201013,
1477,003002,壶化股份,山西,化工原料,山西壶化集团股份有限公司,"Shanxi Huhua Group Co.,Ltd.",hhgf,主板,SZSE,L,20200922,
1478,003003,天元股份,广东,广告包装,广东天元实业集团股份有限公司,"Guangdong Tengen Industrial Group Co.,Ltd.",tygf,主板,SZSE,L,20200921,
1479,003004,声迅股份,北京,软件服务,北京声迅电子股份有限公司,"Beijing Telesound Electronics Co.,Ltd.",sxgf,主板,SZSE,L,20201126,
1480,003005,竞业达,北京,软件服务,北京竞业达数码科技股份有限公司,"Beijing Jingyeda Technology Co.,Ltd.",jyd,主板,SZSE,L,20200922,
1481,003006,百亚股份,重庆,造纸,重庆百亚卫生用品股份有限公司,"Chongqing Baiya Sanitary Products Co., Ltd.",bygf,主板,SZSE,L,20200921,
1482,003007,直真科技,北京,软件服务,北京直真科技股份有限公司,"Beijing Zznode Technologies Co.,Ltd.",zzkj,主板,SZSE,L,20200923,
1483,003008,开普检测,河南,电气设备,许昌开普检测研究院股份有限公司,"Xuchang Ketop Testing Research Institute Co.,Ltd",kpjc,主板,SZSE,L,20200923,
1484,003009,中天火箭,陕西,航空,陕西中天火箭技术股份有限公司,"Shaanxi Zhongtian Rocket Technology Co., Ltd",zthj,主板,SZSE,L,20200925,
1485,003010,若羽臣,广东,互联网,广州若羽臣科技股份有限公司,"Guangzhou Ruoyuchen Technology Co.,Ltd.",ryc,主板,SZSE,L,20200925,
1486,003011,海象新材,浙江,家居用品,浙江海象新材料股份有限公司,"Zhejiang Walrus New Material Co.,Ltd.",hxxc,主板,SZSE,L,20200930,
1487,003012,东鹏控股,广东,陶瓷,广东东鹏控股股份有限公司,"Guangdong Dongpeng Holdings Co.,Ltd.",dpkg,主板,SZSE,L,20201019,
1488,003013,地铁设计,广东,建筑工程,广州地铁设计研究院股份有限公司,"Guangzhou Metro Design&Research Institute Co., Ltd.",dtsj,主板,SZSE,L,20201022,
1489,003015,日久光电,江苏,元器件,江苏日久光电股份有限公司,"Jiangsu Rijiu Optoelectronics Jointstock Co., Ltd.",rjgd,主板,SZSE,L,20201021,
1490,003016,欣贺股份,福建,服饰,欣贺股份有限公司,"Xin Hee Co.,Ltd",xhgf,主板,SZSE,L,20201026,
1491,003017,大洋生物,浙江,化工原料,浙江大洋生物科技集团股份有限公司,"Zhejiang Dayang Biotech Group Co., Ltd.",dysw,主板,SZSE,L,20201026,
1492,003018,金富科技,广东,塑料,金富科技股份有限公司,"Jinfu Technology Co., Ltd.",jfkj,主板,SZSE,L,20201106,
1493,003019,宸展光电,福建,元器件,宸展光电(厦门)股份有限公司,"Tes Touch Embedded Solutions (Xiamen) Co., Ltd.",czgd,主板,SZSE,L,20201117,
1494,003020,立方制药,安徽,化学制药,合肥立方制药股份有限公司,"Hefei Lifeon Pharmaceutical Co.,Ltd.",lfzy,主板,SZSE,L,20201215,
1495,003021,兆威机电,深圳,元器件,深圳市兆威机电股份有限公司,"Shenzhen Zhaowei Machinery & Electronics Co., Ltd.",zwjd,主板,SZSE,L,20201204,
1496,003022,联泓新科,山东,化工原料,联泓新材料科技股份有限公司,Levima Advanced Materials Corporation,lhxk,主板,SZSE,L,20201208,
1497,003023,彩虹集团,四川,家用电器,成都彩虹电器(集团)股份有限公司,"Chengdu Rainbow Appliance(Group)Shares Co.,Ltd.",chjt,主板,SZSE,L,20201211,
1498,003025,思进智能,浙江,机床制造,思进智能成形装备股份有限公司,"Sijin Intelligent Forming Machinery Co., Ltd.",sjzn,主板,SZSE,L,20201211,
1499,003026,中晶科技,浙江,半导体,浙江中晶科技股份有限公司,"Zhejiang Mtcn Technology Co.,Ltd.",zjkj,主板,SZSE,L,20201218,
1500,003027,同兴环保,安徽,环境保护,同兴环保科技股份有限公司,"Tongxing Environmental Protection Technology Co.,Ltd.",txhb,主板,SZSE,L,20201218,
1501,003028,振邦智能,深圳,元器件,深圳市振邦智能科技股份有限公司,Genbyte Technology Inc.,zbzn,主板,SZSE,L,20201228,
1502,003029,吉大正元,吉林,软件服务,长春吉大正元信息技术股份有限公司,"Jilin University Zhengyuan Information Technologies Co.,Ltd.",jdzy,主板,SZSE,L,20201224,
1503,003030,祖名股份,浙江,食品,祖名豆制品股份有限公司,Zuming Bean Products Corp.,zmgf,主板,SZSE,L,20210106,
1504,003031,中瓷电子,河北,元器件,河北中瓷电子科技股份有限公司,"Hebei Sinopack Electronic Technology Co.,Ltd.",zcdz,主板,SZSE,L,20210104,
1505,003032,传智教育,江苏,文教休闲,江苏传智播客教育科技股份有限公司,"Jiangsu Chuanzhiboke Education Technology Co., Ltd.",czjy,主板,SZSE,L,20210112,
1506,003033,征和工业,山东,汽车配件,青岛征和工业股份有限公司,"Qingdao Choho Industrial Co.,Ltd.",zhgy,主板,SZSE,L,20210111,
1507,003035,南网能源,广东,新型电力,南方电网综合能源股份有限公司,"China Southern Power Grid Energy Efficiency&Clean Energy Co.,Ltd.",nwny,主板,SZSE,L,20210119,
1508,003036,泰坦股份,浙江,纺织机械,浙江泰坦股份有限公司,"Zhejiang Taitan Co., Ltd.",ttgf,主板,SZSE,L,20210128,
1509,003037,三和管桩,广东,水泥,广东三和管桩股份有限公司,"Guangdong Sanhe Pile Co.,Ltd.",shgz,主板,SZSE,L,20210204,
1510,003038,鑫铂股份,安徽,铝,安徽鑫铂铝业股份有限公司,"Anhui Xinbo Aluminum Co., Ltd.",xbgf,主板,SZSE,L,20210210,
1511,003039,顺控发展,广东,水务,广东顺控发展股份有限公司,"Guangdong Shunkong Development Co.,Ltd.",skfz,主板,SZSE,L,20210308,
1512,003040,楚天龙,广东,通信设备,楚天龙股份有限公司,"Chutian Dragon Co.,Ltd.",ctl,主板,SZSE,L,20210322,
1513,003041,真爱美家,浙江,纺织,浙江真爱美家股份有限公司,"Zhejiang Truelove Vogue Co., Ltd.",zamj,主板,SZSE,L,20210406,
1514,003042,中农联合,山东,农药化肥,山东中农联合生物科技股份有限公司,"Shandong Sino-Agri United Biotechnology Co.,Ltd",znlh,主板,SZSE,L,20210406,
1515,003043,华亚智能,江苏,半导体,苏州华亚智能科技股份有限公司,"Suzhou Huaya Intelligence Technology Co., Ltd.",hyzn,主板,SZSE,L,20210406,
1516,003816,中国广核,深圳,新型电力,中国广核电力股份有限公司,"Cgn Power Co.,Ltd.",zggh,主板,SZSE,L,20190826,
1517,300001,特锐德,山东,电气设备,青岛特锐德电气股份有限公司,"Qingdao Tgood Electric Co., Ltd.",trd,创业板,SZSE,L,20091030,
1518,300002,神州泰岳,北京,互联网,北京神州泰岳软件股份有限公司,"Beijing Ultrapower Software Co., Ltd.",szty,创业板,SZSE,L,20091030,
1519,300003,乐普医疗,北京,医疗保健,乐普(北京)医疗器械股份有限公司,"Lepu Medical Technology (Beijing) Co.,Ltd.",lpyl,创业板,SZSE,L,20091030,
1520,300004,南风股份,广东,电气设备,南方风机股份有限公司,"Nanfang Ventilator Co., Ltd",nfgf,创业板,SZSE,L,20091030,
1521,300005,探路者,北京,服饰,探路者控股集团股份有限公司,"Toread Holdings Group Co., Ltd.",tlz,创业板,SZSE,L,20091030,
1522,300006,莱美药业,重庆,化学制药,重庆莱美药业股份有限公司,"Chongqing Lummy Pharmaceutical Co.,Ltd",lmyy,创业板,SZSE,L,20091030,
1523,300007,汉威科技,河南,电器仪表,汉威科技集团股份有限公司,Hanwei Electronics Group Corporation,hwkj,创业板,SZSE,L,20091030,
1524,300008,天海防务,上海,船舶,天海融合防务装备技术股份有限公司,"Bestway Marine & Energy Technology Co.,Ltd",thfw,创业板,SZSE,L,20091030,
1525,300009,安科生物,安徽,生物制药,安徽安科生物工程(集团)股份有限公司,"Anhui Anke Biotechnology (Group) Co.,Ltd.",aksw,创业板,SZSE,L,20091030,
1526,300010,*ST豆神,北京,软件服务,豆神教育科技(北京)股份有限公司,Doushen(Beijing) Education & Technology Inc.,stds,创业板,SZSE,L,20091030,
1527,300011,鼎汉技术,北京,运输设备,北京鼎汉技术集团股份有限公司,"Beijing Dinghan Technology Group Co.,Ltd.",dhjs,创业板,SZSE,L,20091030,
1528,300012,华测检测,深圳,电器仪表,华测检测认证集团股份有限公司,Centre Testing International Group Co.Ltd.,hcjc,创业板,SZSE,L,20091030,
1529,300013,新宁物流,河南,仓储物流,河南新宁现代物流股份有限公司,"Henan Xinning Modern Logistics Co.,Ltd.",xnwl,创业板,SZSE,L,20091030,
1530,300014,亿纬锂能,广东,电气设备,惠州亿纬锂能股份有限公司,"Eve Energy Co.,Ltd.",ywln,创业板,SZSE,L,20091030,
1531,300015,爱尔眼科,湖南,医疗保健,爱尔眼科医院集团股份有限公司,"Aier Eye Hospital Group Co.,Ltd",aeyk,创业板,SZSE,L,20091030,
1532,300016,北陆药业,北京,化学制药,北京北陆药业股份有限公司,"Beijing Beilu Pharmaceutical Co.,Ltd",blyy,创业板,SZSE,L,20091030,
1533,300017,网宿科技,上海,软件服务,网宿科技股份有限公司,"Wangsu Science & Technology Co.,Ltd.",wskj,创业板,SZSE,L,20091030,
1534,300018,中元股份,湖北,电气设备,武汉中元华电科技股份有限公司,"Wuhan Zhongyuan Huadian Science & Technology Co.,Ltd.",zygf,创业板,SZSE,L,20091030,
1535,300019,硅宝科技,四川,化工原料,成都硅宝科技股份有限公司,"Chengdu Guibao Science&Technology Co.,Ltd.",gbkj,创业板,SZSE,L,20091030,
1536,300020,银江技术,浙江,软件服务,银江技术股份有限公司,"Enjoyor Technology Co.,Ltd.",yjjs,创业板,SZSE,L,20091030,
1537,300021,大禹节水,甘肃,建筑工程,大禹节水集团股份有限公司,"Dayu Irrigation Group Co.,Ltd",dyjs,创业板,SZSE,L,20091030,
1538,300022,吉峰科技,四川,农用机械,吉峰三农科技服务股份有限公司,"Gifore Agricultural Science & Technology Service Co., Ltd.",jfkj,创业板,SZSE,L,20091030,
1539,300024,机器人,辽宁,专用机械,沈阳新松机器人自动化股份有限公司,"Siasun Robot&Automation Co.,Ltd.",jqr,创业板,SZSE,L,20091030,
1540,300025,华星创业,浙江,通信设备,杭州华星创业通信技术股份有限公司,"Hangzhou Huaxing Chuangye Communication Technology Co.,Ltd.",hxcy,创业板,SZSE,L,20091030,
1541,300026,红日药业,天津,中成药,天津红日药业股份有限公司,"Tianjin Chase Sun Pharmaceutical Co., Ltd",hryy,创业板,SZSE,L,20091030,
1542,300027,华谊兄弟,浙江,影视音像,华谊兄弟传媒股份有限公司,Huayi Brothers Media Corporation,hyxd,创业板,SZSE,L,20091030,
1543,300029,ST天龙,江苏,电气设备,江苏华盛天龙光电设备股份有限公司,"Jiangsu Huasheng Tianlong Photoelectric Co.,Ltd.",sttl,创业板,SZSE,L,20091225,
1544,300030,阳普医疗,广东,医疗保健,阳普医疗科技股份有限公司,"Improve Medical Instruments Co.,Ltd",ypyl,创业板,SZSE,L,20091225,
1545,300031,宝通科技,江苏,互联网,无锡宝通科技股份有限公司,Wuxi Boton Technology Ltd.,btkj,创业板,SZSE,L,20091225,
1546,300032,金龙机电,浙江,元器件,金龙机电股份有限公司,"Jinlong Machinery & Electronic Co.,Ltd",jljd,创业板,SZSE,L,20091225,
1547,300033,同花顺,浙江,软件服务,浙江核新同花顺网络信息股份有限公司,"Hithink Royalflush Information Network Co., Ltd.",ths,创业板,SZSE,L,20091225,
1548,300034,钢研高纳,北京,航空,北京钢研高纳科技股份有限公司,"Gaona Aero Material Co.,Ltd.",gygn,创业板,SZSE,L,20091225,
1549,300035,中科电气,湖南,电气设备,湖南中科电气股份有限公司,"Hunan Zhongke Electric Co.,Ltd.",zkdq,创业板,SZSE,L,20091225,
1550,300036,超图软件,北京,软件服务,北京超图软件股份有限公司,"Beijing Supermap Software Co., Ltd.",ctrj,创业板,SZSE,L,20091225,
1551,300037,新宙邦,深圳,化工原料,深圳新宙邦科技股份有限公司,"Shenzhen Capchem Technology Co.,Ltd.",xzb,创业板,SZSE,L,20100108,
1552,300039,上海凯宝,上海,中成药,上海凯宝药业股份有限公司,"Shanghai Kaibao Pharmaceutical Co.,Ltd",shkb,创业板,SZSE,L,20100108,
1553,300040,九洲集团,黑龙江,电气设备,哈尔滨九洲集团股份有限公司,"Harbin Jiuzhou Group Co.,Ltd.",jzjt,创业板,SZSE,L,20100108,
1554,300041,回天新材,湖北,化工原料,湖北回天新材料股份有限公司,"Hubei Huitian New Materials Co., Ltd.",htxc,创业板,SZSE,L,20100108,
1555,300042,朗科科技,深圳,IT设备,深圳市朗科科技股份有限公司,"Netac Technology Co.,Ltd",lkkj,创业板,SZSE,L,20100108,
1556,300043,星辉娱乐,广东,互联网,星辉互动娱乐股份有限公司,Rastar Group,xhyl,创业板,SZSE,L,20100120,
1557,300044,赛为智能,深圳,软件服务,深圳市赛为智能股份有限公司,"Shenzhen Sunwin Intelligent Co.,Ltd.",swzn,创业板,SZSE,L,20100120,
1558,300045,华力创通,北京,IT设备,北京华力创通科技股份有限公司,Hwa Create Corporation,hlct,创业板,SZSE,L,20100120,
1559,300046,台基股份,湖北,半导体,湖北台基半导体股份有限公司,"Tech Semiconductors Co., Ltd.",tjgf,创业板,SZSE,L,20100120,
1560,300047,天源迪科,深圳,软件服务,深圳天源迪科信息技术股份有限公司,"Shenzhen Tianyuan Dic Information Technology Co.,Ltd.",tydk,创业板,SZSE,L,20100120,
1561,300048,合康新能,北京,电气设备,北京合康新能科技股份有限公司,"Hiconics Eco-Energy Technology Co.,Ltd.",hkxn,创业板,SZSE,L,20100120,
1562,300049,福瑞股份,内蒙,医疗保健,内蒙古福瑞医疗科技股份有限公司,"Inner Mongolia Furui Medical Science Co., Ltd.",frgf,创业板,SZSE,L,20100120,
1563,300050,世纪鼎利,广东,通信设备,珠海世纪鼎利科技股份有限公司,"Dingli Corp., Ltd.",sjdl,创业板,SZSE,L,20100120,
1564,300051,三五互联,福建,互联网,厦门三五互联科技股份有限公司,"Xiamen 35.Com Technology Co., Ltd.",swhl,创业板,SZSE,L,20100211,
1565,300052,中青宝,深圳,互联网,深圳中青宝互动网络股份有限公司,"Shenzhen Zqgame Co., Ltd",zqb,创业板,SZSE,L,20100211,
1566,300053,欧比特,广东,半导体,珠海欧比特宇航科技股份有限公司,"Zhuhai Orbita Aerospace Science & Technology Co.,Ltd",obt,创业板,SZSE,L,20100211,
1567,300054,鼎龙股份,湖北,化工原料,湖北鼎龙控股股份有限公司,"Hubei Dinglong CO.,Ltd.",dlgf,创业板,SZSE,L,20100211,
1568,300055,万邦达,北京,环境保护,北京万邦达环保技术股份有限公司,"Beijing Water Business Doctor Co.,Ltd.",wbd,创业板,SZSE,L,20100226,
1569,300056,中创环保,福建,环境保护,厦门中创环保科技股份有限公司,"Xiamen Zhongchuang Environmental Technology Co.,Ltd",zchb,创业板,SZSE,L,20100226,
1570,300057,万顺新材,广东,铝,汕头万顺新材集团股份有限公司,"Shantou Wanshun New Material Group Co., Ltd.",wsxc,创业板,SZSE,L,20100226,
1571,300058,蓝色光标,北京,广告包装,北京蓝色光标数据科技股份有限公司,"Bluefocus Intelligent Communications Group Co., Ltd.",lsgb,创业板,SZSE,L,20100226,
1572,300059,东方财富,上海,证券,东方财富信息股份有限公司,"East Money Information Co., Ltd.",dfcf,创业板,SZSE,L,20100319,
