,symbol,name,area,industry,fullname,enname,cnspell,market,exchange,list_status,list_date,delist_date
3791,601921,浙版传媒,浙江,出版业,浙江出版传媒股份有限公司,"Zhejiang Publishing & Media Co., Ltd.",zbcm,主板,SSE,L,20210723,
3792,601928,凤凰传媒,江苏,出版业,江苏凤凰出版传媒股份有限公司,Jiangsu Phoenix Publishing&Media Corporation Limited,fhcm,主板,SSE,L,20111130,
3793,601929,吉视传媒,吉林,影视音像,吉视传媒股份有限公司,"Jishi Media Co., Ltd.",jscm,主板,SSE,L,20120223,
3794,601933,永辉超市,福建,超市连锁,永辉超市股份有限公司,"Yonghui Superstores Co., Ltd.",yhcs,主板,SSE,L,20101215,
3795,601939,建设银行,北京,银行,中国建设银行股份有限公司,China Construction Bank Corporation,jsyh,主板,SSE,L,20070925,
3796,601949,中国出版,北京,出版业,中国出版传媒股份有限公司,"China Publishing&Media Holdings Co.,Ltd",zgcb,主板,SSE,L,20170821,
3797,601952,苏垦农发,江苏,种植业,江苏省农垦农业发展股份有限公司,"Jiangsu Provincial Agricultural Reclamation and Development Co.,Ltd.",sknf,主板,SSE,L,20170515,
3798,601956,东贝集团,湖北,家用电器,湖北东贝机电集团股份有限公司,"Hubei Donper Electromechanical Group Co., Ltd.",dbjt,主板,SSE,L,20201225,
3799,601958,金钼股份,陕西,小金属,金堆城钼业股份有限公司,"Jinduicheng Molybdenum Co.,Ltd.",jmgf,主板,SSE,L,20080417,
3800,601963,重庆银行,重庆,银行,重庆银行股份有限公司,"Bank of Chongqing Co., Ltd.",cqyh,主板,SSE,L,20210205,
3801,601965,中国汽研,重庆,汽车服务,中国汽车工程研究院股份有限公司,"China Automotive Engineering Research Institute Co., Ltd",zgqy,主板,SSE,L,20120611,
3802,601966,玲珑轮胎,山东,汽车配件,山东玲珑轮胎股份有限公司,"Shandong Linglong Tyre Co.,Ltd.",lllt,主板,SSE,L,20160706,
3803,601968,宝钢包装,上海,广告包装,上海宝钢包装股份有限公司,"Shanghai Baosteel Packaging Co.,Ltd.",bgbz,主板,SSE,L,20150611,
3804,601969,海南矿业,海南,普钢,海南矿业股份有限公司,"Hainan Mining Co., Ltd",hnky,主板,SSE,L,20141209,
3805,601975,招商南油,江苏,水运,招商局南京油运股份有限公司,Nanjing Tanker Corporation,zsny,主板,SSE,L,20190108,
3806,601985,中国核电,北京,新型电力,中国核能电力股份有限公司,"China National Nuclear Power Co., Ltd",zghd,主板,SSE,L,20150610,
3807,601988,中国银行,北京,银行,中国银行股份有限公司,Bank of China Limited,zgyh,主板,SSE,L,20060705,
3808,601989,中国重工,北京,船舶,中国船舶重工股份有限公司,China Shipbuilding Industry Company Limited,zgzg,主板,SSE,L,20091216,
3809,601990,南京证券,江苏,证券,南京证券股份有限公司,"Nanjing Securities Co.,Ltd.",njzq,主板,SSE,L,20180613,
3810,601991,大唐发电,北京,火力发电,大唐国际发电股份有限公司,"Datang International Power Generation Co.,Ltd.",dtfd,主板,SSE,L,20061220,
3811,601992,金隅集团,北京,水泥,北京金隅集团股份有限公司,BBMG Corporation,jyjt,主板,SSE,L,20110301,
3812,601995,中金公司,北京,证券,中国国际金融股份有限公司,China International Capital Corporation Limited,zjgs,主板,SSE,L,20201102,
3813,601996,丰林集团,广西,家居用品,广西丰林木业集团股份有限公司,"Guangxi Fenglin Wood Industry Group Co., Ltd.",fljt,主板,SSE,L,20110929,
3814,601997,贵阳银行,贵州,银行,贵阳银行股份有限公司,"Bank of Guiyang Co.,Ltd.",gyyh,主板,SSE,L,20160816,
3815,601998,中信银行,北京,银行,中信银行股份有限公司,China Citic Bank Corporation Limited,zxyh,主板,SSE,L,20070427,
3816,601999,出版传媒,辽宁,出版业,北方联合出版传媒(集团)股份有限公司,Northern United Publishing & Media (Group) Company Limited,cbcm,主板,SSE,L,20071221,
3817,603000,人民网,北京,互联网,人民网股份有限公司,"People.Cn Co.,Ltd",rmw,主板,SSE,L,20120427,
3818,603001,ST奥康,浙江,服饰,浙江奥康鞋业股份有限公司,"Zhejiang Aokang Shoes Co.,Ltd.",stak,主板,SSE,L,20120426,
3819,603002,宏昌电子,广东,化工原料,宏昌电子材料股份有限公司,Epoxy Base Electronic Material Corporation Limited,hcdz,主板,SSE,L,20120518,
3820,603003,龙宇股份,上海,石油贸易,上海龙宇数据股份有限公司,"Shanghai Lonyer Data Co.,Ltd.",lygf,主板,SSE,L,20120817,
3821,603005,晶方科技,江苏,半导体,苏州晶方半导体科技股份有限公司,"China Wafer Level Csp Co.,Ltd.",jfkj,主板,SSE,L,20140210,
3822,603006,联明股份,上海,汽车配件,上海联明机械股份有限公司,"Shanghai Lianming Machinery Co., Ltd.",lmgf,主板,SSE,L,20140630,
3823,603007,ST花王,江苏,建筑工程,花王生态工程股份有限公司,Flower King Eco-Engineering Inc.,sthw,主板,SSE,L,20160826,
3824,603008,喜临门,浙江,家居用品,喜临门家具股份有限公司,"Xilinmen Furniture Co., Ltd",xlm,主板,SSE,L,20120717,
3825,603009,北特科技,上海,汽车配件,上海北特科技股份有限公司,"Shanghai Beite Technology Co.,Ltd.",btkj,主板,SSE,L,20140718,
3826,603010,万盛股份,浙江,化工原料,浙江万盛股份有限公司,"Zhejiang Wansheng Co.,Ltd",wsgf,主板,SSE,L,20141010,
3827,603011,合锻智能,安徽,机床制造,合肥合锻智能制造股份有限公司,"Hefei Metalforming Intelligent Manufacturing Co., Ltd.",hdzn,主板,SSE,L,20141107,
3828,603012,创力集团,上海,专用机械,上海创力集团股份有限公司,"Shanghai Chuangli Group Co.,Ltd.",cljt,主板,SSE,L,20150320,
3829,603013,亚普股份,江苏,汽车配件,亚普汽车部件股份有限公司,"Yapp Automotive Systems Co.,Ltd.",ypgf,主板,SSE,L,20180509,
3830,603015,弘讯科技,浙江,电气设备,宁波弘讯科技股份有限公司,"Ningbo Techmation Co., Ltd.",hxkj,主板,SSE,L,20150303,
3831,603016,新宏泰,江苏,电气设备,无锡新宏泰电器科技股份有限公司,"Wuxi New Hongtai Electrical Technology Co.,Ltd",xht,主板,SSE,L,20160701,
3832,603017,中衡设计,江苏,建筑工程,中衡设计集团股份有限公司,"ARTS Group Co.,Ltd",zhsj,主板,SSE,L,20141231,
3833,603018,华设集团,江苏,建筑工程,华设设计集团股份有限公司,"China Design Group Co.,Ltd",hsjt,主板,SSE,L,20141013,
3834,603019,中科曙光,天津,IT设备,曙光信息产业股份有限公司,"Dawning Information Industry Co.,Ltd",zksg,主板,SSE,L,20141106,
3835,603020,爱普股份,上海,食品,爱普香料集团股份有限公司,"Apple Flavor & Fragrance Group Co., Ltd.",apgf,主板,SSE,L,20150325,
3836,603021,山东华鹏,山东,家居用品,山东华鹏玻璃股份有限公司,"Shandong Huapeng Glass Co.,Ltd.",sdhp,主板,SSE,L,20150423,
3837,603022,新通联,上海,广告包装,上海新通联包装股份有限公司,"Shanghai Xintonglian Packing Co.,Ltd",xtl,主板,SSE,L,20150518,
3838,603023,威帝股份,黑龙江,汽车配件,哈尔滨威帝电子股份有限公司,Harbin Viti Electronics Corp.,wdgf,主板,SSE,L,20150527,
3839,603025,大豪科技,北京,纺织机械,北京大豪科技股份有限公司,"Beijing Dahao Technology Corp.,Ltd",dhkj,主板,SSE,L,20150422,
3840,603026,胜华新材,山东,化工原料,胜华新材料集团股份有限公司,"Shinghwa Advanced Material Group Co.,Ltd.",shxc,主板,SSE,L,20150529,
3841,603027,千禾味业,四川,食品,千禾味业食品股份有限公司,"Qianhe Condiment and Food Co., Ltd",qhwy,主板,SSE,L,20160307,
3842,603028,赛福天,江苏,钢加工,江苏赛福天钢索股份有限公司,"Jiangsu Safety Wire Rope Co., Ltd.",sft,主板,SSE,L,20160331,
3843,603029,天鹅股份,山东,农用机械,山东天鹅棉业机械股份有限公司,"Shandong Swan Cotton Industrial Machinery Stock Co., Ltd.",tegf,主板,SSE,L,20160427,
3844,603030,*ST全筑,上海,装修装饰,上海全筑控股集团股份有限公司,"Shanghai Trendzone Holdings Group Co.,Ltd",stqz,主板,SSE,L,20150320,
3845,603031,安孚科技,安徽,电气设备,安徽安孚电池科技股份有限公司,"Anhui Anfu Battery Technology Co.,Ltd",afkj,主板,SSE,L,20160822,
3846,603032,德新科技,新疆,专用机械,德力西新能源科技股份有限公司,"Delixi New Energy Technology Co.,Ltd",dxkj,主板,SSE,L,20170105,
3847,603033,三维股份,浙江,橡胶,三维控股集团股份有限公司,"Sanwei Holding Group Co.,Ltd",swgf,主板,SSE,L,20161207,
3848,603035,常熟汽饰,江苏,汽车配件,江苏常熟汽饰集团股份有限公司,"Jiangsu Changshu Automotive Trim Group Co.,Ltd.",csqs,主板,SSE,L,20170105,
3849,603036,如通股份,江苏,专用机械,江苏如通石油机械股份有限公司,"Jiangsu Rutong Petro-Machinery Co., Ltd.",rtgf,主板,SSE,L,20161209,
3850,603037,凯众股份,上海,汽车配件,上海凯众材料科技股份有限公司,"Shanghai Carthane Co., Ltd",kzgf,主板,SSE,L,20170120,
3851,603038,华立股份,广东,家居用品,东莞市华立实业股份有限公司,"Dongguan Huali Industries Co., Ltd.",hlgf,主板,SSE,L,20170116,
3852,603039,泛微网络,上海,软件服务,上海泛微网络科技股份有限公司,"Shanghai Weaver Network Co., Ltd.",fwwl,主板,SSE,L,20170113,
3853,603040,新坐标,浙江,汽车配件,杭州新坐标科技股份有限公司,"Hangzhou XZB Tech Co.,Ltd",xzb,主板,SSE,L,20170209,
3854,603041,美思德,江苏,化工原料,江苏美思德化学股份有限公司,"Jiangsu Maysta Chemical Co., Ltd",msd,主板,SSE,L,20170330,
3855,603042,华脉科技,江苏,通信设备,南京华脉科技股份有限公司,"Nanjing Huamai Technology Co., Ltd.",hmkj,主板,SSE,L,20170602,
3856,603043,广州酒家,广东,食品,广州酒家集团股份有限公司,Guangzhou Restaurant Group Company Limited,gzjj,主板,SSE,L,20170627,
3857,603045,福达合金,浙江,电气设备,福达合金材料股份有限公司,"Fuda Alloy Materials Co.,Ltd",fdhj,主板,SSE,L,20180517,
3858,603048,浙江黎明,浙江,汽车配件,浙江黎明智造股份有限公司,"Zhejiang Liming Intelligent Manufacturing Co.,Ltd",zjlm,主板,SSE,L,20211116,
3859,603050,科林电气,河北,电气设备,石家庄科林电气股份有限公司,"ShiJiaZhuang Kelin Electric Co., Ltd.",kldq,主板,SSE,L,20170414,
3860,603051,鹿山新材,广东,塑料,广州鹿山新材料股份有限公司,"Guangzhou Lushan New Materials Co., Ltd.",lsxc,主板,SSE,L,20220325,
3861,603052,可川科技,江苏,元器件,苏州可川电子科技股份有限公司,"Suzhou K-Hiragawa Electronic Technology Co., Ltd.",kckj,主板,SSE,L,20221011,
3862,603053,成都燃气,四川,供气供热,成都燃气集团股份有限公司,Chengdu Gas Group Corporation Ltd.,cdrq,主板,SSE,L,20191217,
3863,603055,台华新材,浙江,纺织,浙江台华新材料股份有限公司,"Zhejiang Taihua New Material Co., Ltd",thxc,主板,SSE,L,20170921,
3864,603056,德邦股份,上海,仓储物流,德邦物流股份有限公司,"Deppon Logistics Co.,Ltd.",dbgf,主板,SSE,L,20180116,
3865,603057,紫燕食品,上海,食品,上海紫燕食品股份有限公司,"Shanghai Ziyan Foods Co., Ltd.",zysp,主板,SSE,L,20220926,
3866,603058,永吉股份,贵州,广告包装,贵州永吉印务股份有限公司,"GuiZhou YongJi Printing CO.,LTD",yjgf,主板,SSE,L,20161223,
3867,603059,倍加洁,江苏,日用化工,倍加洁集团股份有限公司,"Perfect Group Corp.,Ltd",bjj,主板,SSE,L,20180302,
3868,603060,国检集团,北京,建筑工程,中国国检测试控股集团股份有限公司,"China Testing & Certification International Group Co.,Ltd.",gjjt,主板,SSE,L,20161109,
3869,603061,金海通,天津,半导体,天津金海通半导体设备股份有限公司,"Jht Design Co.,Ltd.",jht,主板,SSE,L,20230303,
3870,603063,禾望电气,深圳,电气设备,深圳市禾望电气股份有限公司,"Shenzhen Hopewind Electric Co.,Ltd.",hwdq,主板,SSE,L,20170728,
3871,603065,宿迁联盛,江苏,化工原料,宿迁联盛科技股份有限公司,"Suqian Unitech Corp., Ltd.",sqls,主板,SSE,L,20230321,
3872,603066,音飞储存,江苏,仓储物流,南京音飞储存设备(集团)股份有限公司,"Nanjing Inform Storage Equipment (Group) Co., Ltd.",yfcc,主板,SSE,L,20150611,
3873,603067,振华股份,湖北,化工原料,湖北振华化学股份有限公司,"Hubei Zhenhua Chemical Co.,Ltd",zhgf,主板,SSE,L,20160913,
3874,603068,博通集成,上海,半导体,博通集成电路(上海)股份有限公司,Beken Corporation,btjc,主板,SSE,L,20190415,
3875,603069,海汽集团,海南,公路,海南海汽运输集团股份有限公司,"Hainan Haiqi Transportation Group Co.,Ltd.",hqjt,主板,SSE,L,20160712,
3876,603070,万控智造,浙江,电气设备,万控智造股份有限公司,"Wecome Intelligent Manufacturing Co., Ltd.",wkzz,主板,SSE,L,20220310,
3877,603071,物产环能,浙江,批发业,浙江物产环保能源股份有限公司,"ZJMI Environmental Energy Co.,Ltd.",wchn,主板,SSE,L,20211216,
3878,603073,彩蝶实业,浙江,纺织,浙江彩蝶实业股份有限公司,"Zhejiang Cady Industry Co., Ltd.",cdsy,主板,SSE,L,20230316,
3879,603076,乐惠国际,浙江,专用机械,宁波乐惠国际工程装备股份有限公司,"Ningbo Lehui International Engineering Equipment Co.,Ltd",lhgj,主板,SSE,L,20171113,
3880,603077,和邦生物,四川,化工原料,四川和邦生物科技股份有限公司,"Sichuanhebang Biotechnology Co.,Ltd.",hbsw,主板,SSE,L,20120731,
3881,603078,江化微,江苏,半导体,江阴江化微电子材料股份有限公司,"Jiangyin Jianghua Micro-electronic Materials Co., Ltd",jhw,主板,SSE,L,20170410,
3882,603079,圣达生物,浙江,食品,浙江圣达生物药业股份有限公司,"Zhejiang Shengda Bio-Pharm Co.,Ltd.",sdsw,主板,SSE,L,20170823,
3883,603080,新疆火炬,新疆,供气供热,新疆火炬燃气股份有限公司,"Xinjiang Torch Gas Co.,Ltd",xjhj,主板,SSE,L,20180103,
3884,603081,大丰实业,浙江,专用机械,浙江大丰实业股份有限公司,"Zhejiang Dafeng Industry Co., Ltd",dfsy,主板,SSE,L,20170420,
3885,603083,剑桥科技,上海,通信设备,上海剑桥科技股份有限公司,"Cig Shanghai Co., Ltd.",jqkj,主板,SSE,L,20171110,
3886,603085,天成自控,浙江,汽车配件,浙江天成自控股份有限公司,"Zhejiang Tiancheng Controls Co.,Ltd",tczk,主板,SSE,L,20150630,
3887,603086,先达股份,山东,农药化肥,山东先达农化股份有限公司,"Shandong Cynda Chemical Co.,Ltd",xdgf,主板,SSE,L,20170511,
3888,603087,甘李药业,北京,生物制药,甘李药业股份有限公司,Gan & Lee Pharmaceuticals.,glyy,主板,SSE,L,20200629,
3889,603088,宁波精达,浙江,机床制造,宁波精达成形装备股份有限公司,"JDM JingDa Machine(Ningbo) Co.,Ltd",nbjd,主板,SSE,L,20141111,
3890,603089,正裕工业,浙江,汽车配件,浙江正裕工业股份有限公司,"ADD Industry (Zhejiang) Co., Ltd",zygy,主板,SSE,L,20170126,
3891,603090,宏盛股份,江苏,专用机械,无锡宏盛换热器制造股份有限公司,"Wuxi Hongsheng Heat Exchanger Manufacturing Co., Ltd.",hsgf,主板,SSE,L,20160831,
3892,603093,南华期货,浙江,多元金融,南华期货股份有限公司,"Nanhua Futures Co.,Ltd.",nhqh,主板,SSE,L,20190830,
3893,603095,越剑智能,浙江,纺织机械,浙江越剑智能装备股份有限公司,"Zhejiang Yuejian Intelligent Equipment Co.,Ltd.",yjzn,主板,SSE,L,20200415,
3894,603096,新经典,天津,出版业,新经典文化股份有限公司,Thinkingdom Media Group Ltd,xjd,主板,SSE,L,20170425,
3895,603097,江苏华辰,江苏,电气设备,江苏华辰变压器股份有限公司,"Jiangsu Huachen Transformer Co.,Ltd.",jshc,主板,SSE,L,20220512,
3896,603098,森特股份,北京,装修装饰,森特士兴集团股份有限公司,"Center International Group Co.,Ltd.",stgf,主板,SSE,L,20161216,
3897,603099,长白山,吉林,旅游景点,长白山旅游股份有限公司,"Changbai Mountain Tourism Co.,Ltd",cbs,主板,SSE,L,20140822,
3898,603100,川仪股份,重庆,电器仪表,重庆川仪自动化股份有限公司,"Chongqing Chuanyi Automation Co.,Ltd.",cygf,主板,SSE,L,20140805,
3899,603101,汇嘉时代,新疆,百货,新疆汇嘉时代百货股份有限公司,"Xinjiang Wuika Times Department Store Co.,Ltd.",hjsd,主板,SSE,L,20160506,
3900,603102,百合股份,山东,医疗保健,威海百合生物技术股份有限公司,"Weihai Baihe Biology Technological Co., Ltd.",bhgf,主板,SSE,L,20220125,
3901,603103,横店影视,浙江,影视音像,横店影视股份有限公司,"Hengdian Entertainment Co., Ltd",hdys,主板,SSE,L,20171012,
3902,603105,芯能科技,浙江,电气设备,浙江芯能光伏科技股份有限公司,"Zhejiang Sunoren Solar Technology Co.,Ltd.",xnkj,主板,SSE,L,20180709,
3903,603106,恒银科技,天津,IT设备,恒银金融科技股份有限公司,"Cashway Fintech Co.,Ltd.",hykj,主板,SSE,L,20170920,
3904,603108,润达医疗,上海,医药商业,上海润达医疗科技股份有限公司,"Shanghai Runda Medical Technology Co., Ltd.",rdyl,主板,SSE,L,20150527,
3905,603109,神驰机电,重庆,电气设备,神驰机电股份有限公司,"Senci Electric Machinery Co.,Ltd.",scjd,主板,SSE,L,20191231,
3906,603110,东方材料,安徽,染料涂料,新东方新材料股份有限公司,"New East New Materials Co.,Ltd",dfcl,主板,SSE,L,20171013,
3907,603111,康尼机电,江苏,运输设备,南京康尼机电股份有限公司,"Nanjing Kangni Mechanical & Electrical Co.,Ltd",knjd,主板,SSE,L,20140801,
3908,603112,华翔股份,山西,机械基件,山西华翔集团股份有限公司,"Shanxi Huaxiang Group Co., Ltd",hxgf,主板,SSE,L,20200917,
3909,603113,金能科技,山东,焦炭加工,金能科技股份有限公司,"Jinneng Science&Technology Co.,Ltd",jnkj,主板,SSE,L,20170511,
3910,603115,海星股份,江苏,铝,南通海星电子股份有限公司,"Nantong Haixing Electronics Co., Ltd.",hxgf,主板,SSE,L,20190809,
3911,603116,红蜻蜓,浙江,服饰,浙江红蜻蜓鞋业股份有限公司,"Zhejiang Red Dragonfly Footwear Co.,Ltd",hqt,主板,SSE,L,20150629,
3912,603117,ST万林,江苏,仓储物流,江苏万林现代物流股份有限公司,"Jiangsu Wanlin Modern Logistics Co., Ltd.",stwl,主板,SSE,L,20150629,
3913,603118,共进股份,深圳,通信设备,深圳市共进电子股份有限公司,"Shenzhen Gongjin Electronics Co., Ltd",gjgf,主板,SSE,L,20150225,
3914,603121,华培动力,上海,汽车配件,上海华培动力科技(集团)股份有限公司,"Shanghai Sinotec Co., Ltd.",hpdl,主板,SSE,L,20190111,
3915,603122,合富中国,上海,医药商业,合富(中国)医疗科技股份有限公司,"Cowealth Medical China Co.,Ltd.",hfzg,主板,SSE,L,20220216,
3916,603123,翠微股份,北京,多元金融,北京翠微大厦股份有限公司,"Beijing Cuiwei Tower Co., Ltd.",cwgf,主板,SSE,L,20120503,
3917,603125,常青科技,江苏,化工原料,江苏常青树新材料科技股份有限公司,Jiangsu Evergreen Material Technology Incorporated Company,cqkj,主板,SSE,L,20230410,
3918,603126,中材节能,天津,环境保护,中材节能股份有限公司,Sinoma Energy Conservation Ltd.,zcjn,主板,SSE,L,20140731,
3919,603127,昭衍新药,北京,医疗保健,北京昭衍新药研究中心股份有限公司,"Joinn Laboratories (China) Co.,Ltd.",zyxy,主板,SSE,L,20170825,
3920,603128,华贸物流,上海,仓储物流,港中旅华贸国际物流股份有限公司,CTS International Logistics Corporation Limited,hmwl,主板,SSE,L,20120529,
3921,603129,春风动力,浙江,摩托车,浙江春风动力股份有限公司,"Zhejiang Cfmoto Power Co.,Ltd",cfdl,主板,SSE,L,20170818,
3922,603130,云中马,浙江,纺织,浙江云中马股份有限公司,"Zhejiang Yunzhongma Co., Ltd.",yzm,主板,SSE,L,20221118,
3923,603131,上海沪工,上海,专用机械,上海沪工焊接集团股份有限公司,"Shanghai Hugong Electric Group Co.,Ltd.",shhg,主板,SSE,L,20160607,
3924,603132,金徽股份,甘肃,铅锌,金徽矿业股份有限公司,Jinhui Mining Incorporation Limited,jhgf,主板,SSE,L,20220222,
3925,603133,*ST碳元,江苏,元器件,碳元科技股份有限公司,"Tanyuan Technology Co., Ltd.",stty,主板,SSE,L,20170320,
3926,603135,中重科技,天津,专用机械,中重科技(天津)股份有限公司,"Zhongzhong Science&Technology(Tianjin)Co., Ltd.",zzkj,主板,SSE,L,20230410,
3927,603136,天目湖,江苏,旅游景点,江苏天目湖旅游股份有限公司,"Jiangsu Tianmu Lake Tourism Co.,Ltd.",tmh,主板,SSE,L,20170927,
3928,603137,恒尚节能,江苏,装修装饰,江苏恒尚节能科技股份有限公司,"Jiangsu Hengshang Energy Conservation Technology Co.,Ltd.",hsjn,主板,SSE,L,20230419,
3929,603138,海量数据,北京,软件服务,北京海量数据技术股份有限公司,"Beijing Vastdata Technology Co., Ltd.",hlsj,主板,SSE,L,20170306,
3930,603139,康惠制药,陕西,中成药,陕西康惠制药股份有限公司,"Shaanxi Kanghui Pharmaceutical Co., Ltd",khzy,主板,SSE,L,20170421,
3931,603150,万朗磁塑,安徽,塑料,安徽万朗磁塑股份有限公司,"Anhui Higasket Plastics Co., Ltd.",wlcs,主板,SSE,L,20220124,
3932,603151,邦基科技,山东,饲料,山东邦基科技股份有限公司,"Shandong Teamgene Technology Co., Ltd.",bjkj,主板,SSE,L,20221019,
3933,603153,上海建科,上海,建筑工程,上海建科集团股份有限公司,"Shanghai Research Institute of Building Sciences Group Co., Ltd.",shjk,主板,SSE,L,20230313,
3934,603155,新亚强,江苏,化工原料,新亚强硅化学股份有限公司,"Xinyaqiang Silicon Chemistry Co.,Ltd",xyq,主板,SSE,L,20200901,
3935,603156,养元饮品,河北,软饮料,河北养元智汇饮品股份有限公司,"Hebei Yangyuan Zhihui Beverage Co., Ltd.",yyyp,主板,SSE,L,20180212,
3936,603158,腾龙股份,江苏,汽车配件,常州腾龙汽车零部件股份有限公司,"Changzhou Tenglong Auto Parts Co.,Ltd.",tlgf,主板,SSE,L,20150320,
3937,603159,上海亚虹,上海,专用机械,上海亚虹模具股份有限公司,"Shanghai Yahong Moulding Co.,Ltd",shyh,主板,SSE,L,20160812,
3938,603160,汇顶科技,深圳,半导体,深圳市汇顶科技股份有限公司,"Shenzhen Goodix Technology Co., Ltd.",hdkj,主板,SSE,L,20161017,
3939,603161,科华控股,江苏,汽车配件,科华控股股份有限公司,"Kehua Holdings Co.,Ltd",khkg,主板,SSE,L,20180105,
3940,603162,海通发展,福建,港口,福建海通发展股份有限公司,"Fujian Highton Development Co.,Ltd.",htfz,主板,SSE,L,20230329,
3941,603163,圣晖集成,江苏,建筑工程,圣晖系统集成集团股份有限公司,"Acter Technology Integration Group Co., Ltd.",shjc,主板,SSE,L,20221013,
3942,603165,荣晟环保,浙江,造纸,浙江荣晟环保纸业股份有限公司,"Zhejiang Rongsheng Environmental Protectionpaper Joint Stock Co., Ltd.",rshb,主板,SSE,L,20170117,
3943,603166,福达股份,广西,汽车配件,桂林福达股份有限公司,"Guilin Fuda Co.,Ltd.",fdgf,主板,SSE,L,20141127,
3944,603167,渤海轮渡,山东,水运,渤海轮渡集团股份有限公司,"Bohai Ferry Group Co., Ltd.",bhld,主板,SSE,L,20120906,
3945,603168,莎普爱思,浙江,化学制药,浙江莎普爱思药业股份有限公司,"Zhejiang Shapuaisi Pharmaceutical Co., Ltd.",spas,主板,SSE,L,20140702,
3946,603169,兰石重装,甘肃,专用机械,兰州兰石重型装备股份有限公司,"Lanzhou LS Heavy Equipment Co., Ltd",lszz,主板,SSE,L,20141009,
3947,603170,宝立食品,上海,食品,上海宝立食品科技股份有限公司,"Shanghai Bolex Food Technology Co., Ltd.",blsp,主板,SSE,L,20220715,
3948,603171,税友股份,浙江,软件服务,税友软件集团股份有限公司,"Servyou Software Group Co., Ltd.",sygf,主板,SSE,L,20210630,
3949,603172,万丰股份,浙江,染料涂料,浙江万丰化工股份有限公司,"Zhejiang Wanfeng Chemical Co.,Ltd.",wfgf,主板,SSE,L,20230510,
3950,603173,福斯达,浙江,机械基件,杭州福斯达深冷装备股份有限公司,"Hangzhou Fortune Gas Cryogenic Group Co., Ltd.",fsd,主板,SSE,L,20230130,
3951,603176,汇通集团,河北,建筑工程,汇通建设集团股份有限公司,"Huitong Construction Group Co.,Ltd.",htjt,主板,SSE,L,20211231,
3952,603177,德创环保,浙江,环境保护,浙江德创环保科技股份有限公司,"Zhejiang Tuna Environmental Science & Technology Co.,Ltd.",dchb,主板,SSE,L,20170207,
3953,603178,圣龙股份,浙江,汽车配件,宁波圣龙汽车动力系统股份有限公司,"Ningbo Shenglong Automotive Powertrain System Co.,Ltd",slgf,主板,SSE,L,20170328,
3954,603179,新泉股份,江苏,汽车配件,江苏新泉汽车饰件股份有限公司,"Jiangsu Xinquan Automotive Trim Co.,Ltd.",xqgf,主板,SSE,L,20170317,
3955,603180,金牌厨柜,福建,家居用品,金牌厨柜家居科技股份有限公司,"GoldenHome Living Co., Ltd.",jpcg,主板,SSE,L,20170512,
3956,603181,皇马科技,浙江,化工原料,浙江皇马科技股份有限公司,"Zhejiang Huangma Technology Co.,Ltd",hmkj,主板,SSE,L,20170824,
3957,603182,嘉华股份,山东,食品,山东嘉华生物科技股份有限公司,"Shandong Sinoglory Health Food Co., Ltd.",jhgf,主板,SSE,L,20220909,
3958,603183,建研院,江苏,建筑工程,苏州市建筑科学研究院集团股份有限公司,"Suzhou Institute of Building Science Group Co.,Ltd",jyy,主板,SSE,L,20170905,
3959,603185,弘元绿能,江苏,电气设备,弘元绿色能源股份有限公司,"HOYUAN Green Energy Co.,Ltd.",hyln,主板,SSE,L,20181228,
3960,603186,华正新材,浙江,元器件,浙江华正新材料股份有限公司,"Zhejiang Wazam New Materials Co., Ltd.",hzxc,主板,SSE,L,20170103,
3961,603187,海容冷链,山东,机械基件,青岛海容商用冷链股份有限公司,"Qingdao Hiron Commercial Cold Chain Co., Ltd.",hrll,主板,SSE,L,20181129,
3962,603188,亚邦股份,江苏,染料涂料,江苏亚邦染料股份有限公司,"Jiangsu Yabang Dyestuff Co.,Ltd",ybgf,主板,SSE,L,20140909,
3963,603189,网达软件,上海,软件服务,上海网达软件股份有限公司,"Shanghai Wondertek Software Co., Ltd",wdrj,主板,SSE,L,20160914,
