,symbol,name,area,industry,fullname,enname,cnspell,market,exchange,list_status,list_date,delist_date
2569,301105,鸿铭股份,广东,专用机械,广东鸿铭智能股份有限公司,"Guang Dong Hong Ming Intelligent Joint Stock Co.,Ltd.",hmgf,创业板,SZSE,L,20221230,
2570,301106,骏成科技,江苏,元器件,江苏骏成电子科技股份有限公司,"Jiangsu Smartwin Electronics Technology Co.,Ltd.",jckj,创业板,SZSE,L,20220128,
2571,301107,瑜欣电子,重庆,机械基件,重庆瑜欣平瑞电子股份有限公司,"Chongqing Yuxin Pingrui Electronic Co.,Ltd",yxdz,创业板,SZSE,L,20220524,
2572,301108,洁雅股份,安徽,日用化工,铜陵洁雅生物科技股份有限公司,"Tongling Jieya Biologic Technology Co.,Ltd.",jygf,创业板,SZSE,L,20211203,
2573,301109,军信股份,湖南,环境保护,湖南军信环保股份有限公司,"Hunan Junxin Environmental Protection Co.,Ltd.",jxgf,创业板,SZSE,L,20220413,
2574,301110,青木股份,广东,互联网,青木数字技术股份有限公司,"Qingmu Digital Technology Co.,Ltd",qmgf,创业板,SZSE,L,20220311,
2575,301111,粤万年青,广东,中成药,广东万年青制药股份有限公司,"Guangdong Lifestrong Pharmacy Co., Ltd.",ywnq,创业板,SZSE,L,20211207,
2576,301112,信邦智能,广东,专用机械,广州信邦智能装备股份有限公司,"United Faith Auto-Engineering Co., Ltd.",xbzn,创业板,SZSE,L,20220629,
2577,301113,雅艺科技,浙江,家居用品,浙江雅艺金属科技股份有限公司,"Zhe Jiang Yayi Metal Technology Co.,Ltd",yykj,创业板,SZSE,L,20211222,
2578,301115,建科股份,江苏,建筑工程,常州市建筑科学研究院集团股份有限公司,"Changzhou Architectural Research Institute Group Co.,Ltd.",jkgf,创业板,SZSE,L,20220831,
2579,301116,益客食品,江苏,食品,江苏益客食品集团股份有限公司,"Jiangsu Yike Food Group Co.,Ltd",yksp,创业板,SZSE,L,20220118,
2580,301117,佳缘科技,四川,软件服务,佳缘科技股份有限公司,"Jiayuan Science and Technology Co.,Ltd.",jykj,创业板,SZSE,L,20220117,
2581,301118,恒光股份,湖南,化工原料,湖南恒光科技股份有限公司,"Hunan Hengguang Technology Co., Ltd.",hggf,创业板,SZSE,L,20211118,
2582,301119,正强股份,浙江,汽车配件,杭州正强传动股份有限公司,Hangzhou Zhengqiang Corporation Limited,zqgf,创业板,SZSE,L,20211122,
2583,301120,新特电气,北京,电气设备,新华都特种电气股份有限公司,"Newonder Special Electric Co.,Ltd",xtdq,创业板,SZSE,L,20220419,
2584,301121,紫建电子,重庆,电气设备,重庆市紫建电子股份有限公司,"Chongqing VDL Electronics Co., Ltd.",zjdz,创业板,SZSE,L,20220808,
2585,301122,采纳股份,江苏,医疗保健,采纳科技股份有限公司,"Caina Technology Co., Ltd.",cngf,创业板,SZSE,L,20220126,
2586,301123,奕东电子,广东,元器件,奕东电子科技股份有限公司,"Yd Electronic Technology Co.,Ltd.",yddz,创业板,SZSE,L,20220125,
2587,301125,腾亚精工,江苏,机械基件,南京腾亚精工科技股份有限公司,"Nanjing Toua Hardware&Tools Co.,Ltd.",tyjg,创业板,SZSE,L,20220608,
2588,301126,达嘉维康,湖南,医药商业,湖南达嘉维康医药产业股份有限公司,"Hunan Dajiaweikang Pharmaceutical Industry Co.,Ltd",djwk,创业板,SZSE,L,20211207,
2589,301127,天源环保,湖北,环境保护,武汉天源环保股份有限公司,"Wuhan Tianyuan Environmental Protection Co.,Ltd.",tyhb,创业板,SZSE,L,20211230,
2590,301128,强瑞技术,深圳,专用机械,深圳市强瑞精密技术股份有限公司,"Shenzhen Qiangrui Precision Technology Co., Ltd.",qrjs,创业板,SZSE,L,20211110,
2591,301129,瑞纳智能,安徽,电器仪表,瑞纳智能设备股份有限公司,"Runa Smart Equipment Co.,Ltd.",rnzn,创业板,SZSE,L,20211102,
2592,301130,西点药业,吉林,化学制药,吉林省西点药业科技发展股份有限公司,"Jilin Province Xidian Pharmaceutical Sci-Tech Development Co.,Ltd.",xdyy,创业板,SZSE,L,20220223,
2593,301131,聚赛龙,广东,塑料,广州市聚赛龙工程塑料股份有限公司,"Super-Dragon Engineering Plastics Co., Ltd",jsl,创业板,SZSE,L,20220314,
2594,301132,满坤科技,江西,元器件,吉安满坤科技股份有限公司,"Ji’An Mankun Technology Co.,Ltd.",mkkj,创业板,SZSE,L,20220810,
2595,301133,金钟股份,广东,汽车配件,广州市金钟汽车零件股份有限公司,"Guangzhou Jinzhong Auto Parts Manufacturing Co., Ltd.",jzgf,创业板,SZSE,L,20211126,
2596,301135,瑞德智能,广东,元器件,广东瑞德智能科技股份有限公司,"Guangdong Real-Design Intelligent Technology Co.,Ltd",rdzn,创业板,SZSE,L,20220412,
2597,301136,招标股份,福建,建筑工程,福建省招标股份有限公司,"Fujian Tendering Co., Ltd.",zbgf,创业板,SZSE,L,20220111,
2598,301137,哈焊华通,江苏,机械基件,哈焊所华通(常州)焊业股份有限公司,"Hit Welding Industry Co.,Ltd.",hhht,创业板,SZSE,L,20220322,
2599,301138,华研精机,广东,专用机械,广州华研精密机械股份有限公司,"Guangzhou Huayan Precision Machinery Co.,Ltd.",hyjj,创业板,SZSE,L,20211215,
2600,301139,元道通信,新疆,通信设备,元道通信股份有限公司,"Wintao Communications Co.,Ltd.",ydtx,创业板,SZSE,L,20220708,
2601,301141,中科磁业,浙江,矿物制品,浙江中科磁业股份有限公司,"Zhejiang Zhongke Magnetic Industry Co., Ltd.",zkcy,创业板,SZSE,L,20230403,
2602,301148,嘉戎技术,福建,环境保护,厦门嘉戎技术股份有限公司,"Xiamen Jiarong Technology Corp.,Ltd.",jrjs,创业板,SZSE,L,20220421,
2603,301149,隆华新材,山东,化工原料,山东隆华新材料股份有限公司,"Shandong Longhua New Material Co.,Ltd.",lhxc,创业板,SZSE,L,20211110,
2604,301150,中一科技,湖北,电气设备,湖北中一科技股份有限公司,Hubei Zhongyi Technology Inc.,zykj,创业板,SZSE,L,20220421,
2605,301151,冠龙节能,上海,机械基件,上海冠龙阀门节能设备股份有限公司,"Shanghai Karon Eco-Valve Manufacturing Co.,Ltd.",gljn,创业板,SZSE,L,20220411,
2606,301152,天力锂能,河南,小金属,新乡天力锂能股份有限公司,"Xinxiang Tianli Energy Co.,Ltd.",tlln,创业板,SZSE,L,20220829,
2607,301153,中科江南,北京,软件服务,北京中科江南信息技术股份有限公司,"Beijing Ctj Information Technology Co., Ltd.",zkjn,创业板,SZSE,L,20220518,
2608,301155,海力风电,江苏,电气设备,江苏海力风电设备科技股份有限公司,"Jiangsu Haili Wind Power Equipment Technology Co., Ltd.",hlfd,创业板,SZSE,L,20211124,
2609,301156,美农生物,上海,饲料,上海美农生物科技股份有限公司,"Shanghai Menon Animal Nutrition Technology Co., Ltd.",mnsw,创业板,SZSE,L,20220617,
2610,301157,华塑科技,浙江,电气设备,杭州华塑科技股份有限公司,"Hangzhou Huasu Technology Co.,Ltd.",hskj,创业板,SZSE,L,20230309,
2611,301158,德石股份,山东,专用机械,德州联合石油科技股份有限公司,"Dezhou United Petroleum Technology Co.,Ltd.",dsgf,创业板,SZSE,L,20220117,
2612,301159,三维天地,北京,软件服务,北京三维天地科技股份有限公司,"Beijing Sunwayworld Science&Technology Co., Ltd.",swtd,创业板,SZSE,L,20220107,
2613,301160,翔楼新材,江苏,机械基件,苏州翔楼新材料股份有限公司,"Suzhou Xianglou New Material Co.,Ltd.",xlxc,创业板,SZSE,L,20220606,
2614,301161,唯万密封,上海,工程机械,上海唯万密封科技股份有限公司,Voneseals Technology (Shanghai) Inc.,wwmf,创业板,SZSE,L,20220914,
2615,301162,国能日新,北京,软件服务,国能日新科技股份有限公司,"State Power Rixin Tech.Co.,Ltd.",gnrx,创业板,SZSE,L,20220429,
2616,301163,宏德股份,江苏,机械基件,江苏宏德特种部件股份有限公司,"Jiangsu Hongde Special Parts Co.,Ltd.",hdgf,创业板,SZSE,L,20220419,
2617,301165,锐捷网络,福建,通信设备,锐捷网络股份有限公司,"Ruijie Networks Co., Ltd.",rjwl,创业板,SZSE,L,20221121,
2618,301166,优宁维,上海,医药商业,上海优宁维生物科技股份有限公司,"Shanghai Universal Biotech Co.,Ltd.",ynw,创业板,SZSE,L,20211228,
2619,301167,建研设计,安徽,建筑工程,安徽省建筑设计研究总院股份有限公司,"Anhui Provincial Architectural Design and Research Institute Co., Ltd.",jysj,创业板,SZSE,L,20211206,
2620,301168,通灵股份,江苏,电气设备,江苏通灵电器股份有限公司,"Jiangsu Tongling Electric Co., Ltd.",tlgf,创业板,SZSE,L,20211210,
2621,301169,零点有数,北京,文教休闲,北京零点有数数据科技股份有限公司,"Beijing Dataway Horizon Co.,Ltd.",ldys,创业板,SZSE,L,20211103,
2622,301171,易点天下,陕西,互联网,易点天下网络科技股份有限公司,"Easy Click Worldwide Network Technology Co., Ltd",ydtx,创业板,SZSE,L,20220819,
2623,301175,中科环保,北京,环境保护,北京中科润宇环保科技股份有限公司,"Beijing China Sciences Runyu Environmental Technology Co., Ltd.",zkhb,创业板,SZSE,L,20220708,
2624,301176,逸豪新材,江西,元器件,赣州逸豪新材料股份有限公司,"Ganzhou Yihao New Materials Co., Ltd.",yhxc,创业板,SZSE,L,20220928,
2625,301177,迪阿股份,深圳,服饰,迪阿股份有限公司,Dr Corporation Limited,dagf,创业板,SZSE,L,20211215,
2626,301178,天亿马,广东,软件服务,广东天亿马信息产业股份有限公司,"Guangdong Tian Yi Ma Information Industry Co., Ltd.",tym,创业板,SZSE,L,20211112,
2627,301179,泽宇智能,江苏,软件服务,江苏泽宇智能电力股份有限公司,"Jiangsu Zeyu Intelligent Electric Power Co.,Ltd.",zyzn,创业板,SZSE,L,20211208,
2628,301180,万祥科技,江苏,元器件,苏州万祥科技股份有限公司,"Suzhou Wanxiang Technology Co.,Ltd",wxkj,创业板,SZSE,L,20211116,
2629,301181,标榜股份,江苏,汽车配件,江阴标榜汽车部件股份有限公司,"Jiangyin Pivot Automotive Products Co., Ltd.",bbgf,创业板,SZSE,L,20220221,
2630,301182,凯旺科技,河南,元器件,河南凯旺电子科技股份有限公司,"Henan Carve Electronics Technology Co., Ltd.",kwkj,创业板,SZSE,L,20211223,
2631,301183,东田微,湖北,元器件,湖北东田微科技股份有限公司,"Hubei Doti Micro Technology Co.,Ltd",dtw,创业板,SZSE,L,20220524,
2632,301185,鸥玛软件,山东,软件服务,山东山大鸥玛软件股份有限公司,"Shandong Shanda Oumasoft Co.,Ltd.",omrj,创业板,SZSE,L,20211119,
2633,301186,超达装备,江苏,专用机械,南通超达装备股份有限公司,"Nantong Chaoda Equipment Co., Ltd.",cdzb,创业板,SZSE,L,20211223,
2634,301187,欧圣电气,江苏,家用电器,苏州欧圣电气股份有限公司,"Suzhou Alton Electrical & Mechanical Industry Co.,Ltd",osdq,创业板,SZSE,L,20220422,
2635,301188,力诺特玻,山东,玻璃,山东力诺特种玻璃股份有限公司,"Shandong Linuo Technical Glass Co.,Ltd.",lntb,创业板,SZSE,L,20211111,
2636,301189,奥尼电子,深圳,IT设备,深圳奥尼电子股份有限公司,"Shenzhen Aoni Electronic Co., Ltd.",andz,创业板,SZSE,L,20211228,
2637,301190,善水科技,江西,染料涂料,九江善水科技股份有限公司,"Jiujiang Shanshui Technology Co., Ltd",sskj,创业板,SZSE,L,20211224,
2638,301191,菲菱科思,深圳,通信设备,深圳市菲菱科思通信技术股份有限公司,"Shenzhen Phoenix Telecom Technology Co.,Ltd.",flks,创业板,SZSE,L,20220526,
2639,301192,泰祥股份,湖北,汽车配件,十堰市泰祥实业股份有限公司,"Shiyan Taixiang Industry Co.,Ltd.",txgf,创业板,SZSE,L,20220811,
2640,301193,家联科技,浙江,家居用品,宁波家联科技股份有限公司,"Ningbo Homelink Eco-Itech Co.,Ltd.",jlkj,创业板,SZSE,L,20211209,
2641,301195,北路智控,江苏,软件服务,南京北路智控科技股份有限公司,"Nanjing Bestway Intelligent Control Technology Co., Ltd.",blzk,创业板,SZSE,L,20220801,
2642,301196,唯科科技,福建,专用机械,厦门唯科模塑科技股份有限公司,"Xiamen Voke Mold&Plastic Engineering Co., Ltd.",wkkj,创业板,SZSE,L,20220111,
2643,301197,工大科雅,河北,软件服务,河北工大科雅能源科技股份有限公司,"Hebei Gongda Keya Energy Technology Co.,Ltd.",gdky,创业板,SZSE,L,20220808,
2644,301198,喜悦智行,浙江,塑料,宁波喜悦智行科技股份有限公司,"Ningbo Joy Intelligent Logistics Technology Co.,Ltd.",xyzx,创业板,SZSE,L,20211202,
2645,301199,迈赫股份,山东,专用机械,迈赫机器人自动化股份有限公司,"Mh Robot & Automation Co., Ltd.",mhgf,创业板,SZSE,L,20211207,
2646,301200,大族数控,深圳,专用机械,深圳市大族数控科技股份有限公司,"Shenzhen Han’s CNC Technology Co., Ltd.",dzsk,创业板,SZSE,L,20220228,
2647,301201,诚达药业,浙江,生物制药,诚达药业股份有限公司,"Chengda Pharmaceuticals Co.,Ltd.",cdyy,创业板,SZSE,L,20220120,
2648,301203,国泰环保,浙江,环境保护,杭州国泰环保科技股份有限公司,"Hangzhou Guotai Environmental Protection Technology Co.,Ltd.",gthb,创业板,SZSE,L,20230404,
2649,301205,联特科技,湖北,通信设备,武汉联特科技股份有限公司,"Linktel Technologies Co.,Ltd.",ltkj,创业板,SZSE,L,20220913,
2650,301206,三元生物,山东,食品,山东三元生物科技股份有限公司,"Shandong Sanyuan Biotechnology Co.,Ltd.",sysw,创业板,SZSE,L,20220210,
2651,301207,华兰疫苗,河南,生物制药,华兰生物疫苗股份有限公司,Hualan Biological Bacterin Inc.,hlym,创业板,SZSE,L,20220218,
2652,301208,中亦科技,北京,软件服务,北京中亦安图科技股份有限公司,"Chinaetek Service&Technology Co., Ltd.",zykj,创业板,SZSE,L,20220707,
2653,301209,联合化学,山东,染料涂料,龙口联合化学股份有限公司,"Longkou Union Chemical Co., Ltd.",lhhx,创业板,SZSE,L,20220825,
2654,301211,亨迪药业,湖北,化学制药,湖北亨迪药业股份有限公司,"Hubei Biocause Heilen Pharmaceutical Co., Ltd.",hdyy,创业板,SZSE,L,20211222,
2655,301212,联盛化学,浙江,化工原料,浙江联盛化学股份有限公司,"Zhejiang Realsun Chemical Co.,Ltd.",lshx,创业板,SZSE,L,20220419,
2656,301213,观想科技,四川,软件服务,四川观想科技股份有限公司,"Sichuan Discovery Dream Science&Technology Co.,Ltd.",gxkj,创业板,SZSE,L,20211206,
2657,301215,中汽股份,江苏,汽车服务,中汽研汽车试验场股份有限公司,"Catarc Automotive Proving Ground Co.,Ltd.",zqgf,创业板,SZSE,L,20220308,
2658,301216,万凯新材,浙江,化工原料,万凯新材料股份有限公司,"Wankai New Materials Co.,Ltd.",wkxc,创业板,SZSE,L,20220329,
2659,301217,铜冠铜箔,安徽,元器件,安徽铜冠铜箔集团股份有限公司,"Anhui Tongguan Copper Foil Group Co., Ltd.",tgtb,创业板,SZSE,L,20220127,
2660,301218,华是科技,浙江,软件服务,浙江华是科技股份有限公司,"Zhejiang Whyis Technology Co.,Ltd.",hskj,创业板,SZSE,L,20220307,
2661,301219,腾远钴业,江西,小金属,赣州腾远钴业新材料股份有限公司,"Ganzhou Tengyuan Cobalt New Material Co.,Ltd",tygy,创业板,SZSE,L,20220317,
2662,301220,亚香股份,江苏,化工原料,昆山亚香香料股份有限公司,"Kunshan Asia Aroma Corp., Ltd.",yxgf,创业板,SZSE,L,20220622,
2663,301221,光庭信息,湖北,软件服务,武汉光庭信息技术股份有限公司,"Wuhan Kotei Informatics Co.,Ltd.",gtxx,创业板,SZSE,L,20211222,
2664,301222,浙江恒威,浙江,电气设备,浙江恒威电池股份有限公司,"Zhejiang Hengwei Battery Co.,Ltd.",zjhw,创业板,SZSE,L,20220309,
2665,301223,中荣股份,广东,广告包装,中荣印刷集团股份有限公司,"Zrp Printing Group Co., Ltd.",zrgf,创业板,SZSE,L,20221026,
2666,301225,C恒勃,浙江,汽车配件,恒勃控股股份有限公司,"Hengbo Holdings Co.,Ltd.",hbgf,创业板,SZSE,L,20230616,
2667,301226,祥明智能,江苏,电气设备,常州祥明智能动力股份有限公司,Changzhou Xiangming Intelligent Drive System Corporation,xmzn,创业板,SZSE,L,20220325,
2668,301227,森鹰窗业,黑龙江,家居用品,哈尔滨森鹰窗业股份有限公司,"Harbin Sayyas Windows Co., Ltd.",sycy,创业板,SZSE,L,20220926,
2669,301228,实朴检测,上海,电器仪表,实朴检测技术(上海)股份有限公司,"Sep Analytical (Shanghai) Co.,Ltd.",spjc,创业板,SZSE,L,20220128,
2670,301229,纽泰格,江苏,汽车配件,江苏纽泰格科技集团股份有限公司,"Jiangsu New Technology Group Co.,Ltd.",ntg,创业板,SZSE,L,20220222,
2671,301230,泓博医药,上海,生物制药,上海泓博智源医药股份有限公司,"PharmaResources (Shanghai) Co.,Ltd.",hbyy,创业板,SZSE,L,20221101,
2672,301231,荣信文化,陕西,出版业,荣信教育文化产业发展股份有限公司,Ronshin Group,rxwh,创业板,SZSE,L,20220908,
2673,301232,C飞沃,湖南,机械基件,湖南飞沃新能源科技股份有限公司,"Finework (Hu Nan) New Energy Technology Co.,Ltd",fwkj,创业板,SZSE,L,20230615,
2674,301233,盛帮股份,四川,汽车配件,成都盛帮密封件股份有限公司,"Chengdu Shengbang Seals Co., Ltd",sbgf,创业板,SZSE,L,20220706,
2675,301234,五洲医疗,安徽,医疗保健,安徽宏宇五洲医疗器械股份有限公司,"Anhui Hongyu Wuzhou Medical Manufacturer Co.,Ltd.",wzyl,创业板,SZSE,L,20220705,
2676,301235,华康医疗,湖北,医疗保健,武汉华康世纪医疗股份有限公司,"Wuhan Huakang Century Medical Co., Ltd.",hkyl,创业板,SZSE,L,20220128,
2677,301236,软通动力,北京,软件服务,软通动力信息技术(集团)股份有限公司,"Isoftstone Information Technology (Group) Co.,Ltd.",rtdl,创业板,SZSE,L,20220315,
2678,301237,和顺科技,浙江,塑料,杭州和顺科技股份有限公司,"Hangzhou Heshun Technology Co.,Ltd.",hskj,创业板,SZSE,L,20220323,
2679,301238,瑞泰新材,江苏,化工原料,江苏瑞泰新能源材料股份有限公司,"Jiangsu Ruitai New Energy Materials Co.,Ltd.",rtxc,创业板,SZSE,L,20220617,
2680,301239,普瑞眼科,四川,医疗保健,成都普瑞眼科医院股份有限公司,"Chengdu Bright Eye Hospital Co., Ltd",pryk,创业板,SZSE,L,20220705,
2681,301246,宏源药业,湖北,化学制药,湖北省宏源药业科技股份有限公司,"Hubei Hongyuan Pharmaceutical Technology Co.,Ltd.",hyyy,创业板,SZSE,L,20230320,
2682,301248,杰创智能,广东,软件服务,杰创智能科技股份有限公司,Nexwise Intelligence China Limited,jczn,创业板,SZSE,L,20220420,
2683,301252,同星科技,浙江,机械基件,浙江同星科技股份有限公司,"Zhejiang Tongxing Technology Co.,Ltd.",txkj,创业板,SZSE,L,20230525,
2684,301255,通力科技,浙江,机械基件,浙江通力传动科技股份有限公司,"Zhejiang Tongli Transmission Technology Co., Ltd.",tlkj,创业板,SZSE,L,20221227,
2685,301256,华融化学,四川,化工原料,华融化学股份有限公司,"Huarong Chemical Co., Ltd.",hrhx,创业板,SZSE,L,20220322,
2686,301257,普蕊斯,上海,医疗保健,普蕊斯(上海)医药科技开发股份有限公司,"Smo Clinplus Co.,Ltd.",prs,创业板,SZSE,L,20220517,
2687,301258,富士莱,江苏,化学制药,苏州富士莱医药股份有限公司,"Suzhou Fushilai Pharmaceutical Co.,Ltd.",fsl,创业板,SZSE,L,20220329,
2688,301259,艾布鲁,湖南,环境保护,湖南艾布鲁环保科技股份有限公司,"Hunan Airbluer Environmental Protection Technology Co.,Ltd.",abl,创业板,SZSE,L,20220426,
2689,301260,格力博,江苏,专用机械,格力博(江苏)股份有限公司,"Greenworks (Jiangsu) Co., Ltd.",glb,创业板,SZSE,L,20230208,
2690,301262,C海看,山东,影视音像,海看网络科技(山东)股份有限公司,"Hicon Network Technology(Shandong)Co.,Ltd.",hkgf,创业板,SZSE,L,20230620,
2691,301263,泰恩康,广东,医药商业,广东泰恩康医药股份有限公司,"Guangdong Taienkang Pharmaceutical Co.,Ltd.",tek,创业板,SZSE,L,20220329,
2692,301265,华新环保,北京,环境保护,华新绿源环保股份有限公司,"Hwaxin Environmental Co.,Ltd.",hxhb,创业板,SZSE,L,20221216,
2693,301266,宇邦新材,江苏,电气设备,苏州宇邦新型材料股份有限公司,"Suzhou Yourbest New-Type Materials Co.,Ltd.",ybxc,创业板,SZSE,L,20220608,
2694,301267,华厦眼科,福建,医疗保健,华厦眼科医院集团股份有限公司,"Huaxia Eye Hospital Group Co.,Ltd.",hxyk,创业板,SZSE,L,20221107,
2695,301268,铭利达,深圳,机械基件,深圳市铭利达精密技术股份有限公司,"Shenzhen Minglida Precision Technology Co.,Ltd.",mld,创业板,SZSE,L,20220407,
2696,301269,华大九天,北京,半导体,北京华大九天科技股份有限公司,"Empyrean Technology Co., Ltd.",hdjt,创业板,SZSE,L,20220729,
2697,301270,汉仪股份,北京,软件服务,北京汉仪创新科技股份有限公司,"Beijing Hanyi Innovation Technology Co., Ltd.",hygf,创业板,SZSE,L,20220831,
2698,301273,瑞晨环保,上海,机械基件,上海瑞晨环保科技股份有限公司,"Shanghai Rychen Technologies Co., Ltd.",rchb,创业板,SZSE,L,20221025,
2699,301276,嘉曼服饰,北京,服饰,北京嘉曼服饰股份有限公司,"Beijing Jiaman Dress Co.,Ltd",jmfs,创业板,SZSE,L,20220909,
2700,301277,新天地,河南,化学制药,河南新天地药业股份有限公司,"Henan Newland Pharmaceutical Co.,Ltd.",xtd,创业板,SZSE,L,20221116,
2701,301278,快可电子,江苏,电气设备,苏州快可光伏电子股份有限公司,Qc Solar Corporation,kkdz,创业板,SZSE,L,20220804,
2702,301279,金道科技,浙江,机械基件,浙江金道科技股份有限公司,"Zhejiang Jindao Technology Co., Ltd.",jdkj,创业板,SZSE,L,20220413,
2703,301280,珠城科技,浙江,元器件,浙江珠城科技股份有限公司,"Zhejiang Zuch Technology Co.,Ltd.",zckj,创业板,SZSE,L,20221226,
2704,301281,科源制药,山东,化学制药,山东科源制药股份有限公司,"Shandong Keyuan Pharmaceutical Co.,Ltd.",kyzy,创业板,SZSE,L,20230404,
2705,301282,金禄电子,广东,元器件,金禄电子科技股份有限公司,"Camelot Electronics Technology Co.,Ltd.",jldz,创业板,SZSE,L,20220826,
2706,301283,聚胶股份,广东,日用化工,聚胶新材料股份有限公司,Focus Hotmelt Company Ltd.,jjgf,创业板,SZSE,L,20220902,
2707,301285,鸿日达,江苏,元器件,鸿日达科技股份有限公司,Hong Ri Da Technology Company Limited,hrd,创业板,SZSE,L,20220928,
2708,301286,侨源股份,四川,化工原料,四川侨源气体股份有限公司,"Sichuan Qiaoyuan Gas Co.,Ltd.",qygf,创业板,SZSE,L,20220614,
2709,301287,康力源,江苏,文教休闲,江苏康力源体育科技股份有限公司,"Jiangsu Junxia Gym Equipment Co., Ltd",kly,创业板,SZSE,L,20230614,
2710,301288,清研环境,深圳,环境保护,清研环境科技股份有限公司,"Qingyan Environmental Technology Co., Ltd.",qyhj,创业板,SZSE,L,20220422,
2711,301289,国缆检测,上海,电器仪表,上海国缆检测股份有限公司,"Shanghai National Center of Testing and Inspection For Electric Cable and Wire Co., Ltd",gljc,创业板,SZSE,L,20220622,
2712,301290,东星医疗,江苏,医疗保健,江苏东星智慧医疗科技股份有限公司,"Jiangsu Canopus Wisdom Medical Technology Co.,Ltd.",dxyl,创业板,SZSE,L,20221130,
2713,301293,三博脑科,北京,医疗保健,三博脑科医院管理集团股份有限公司,Sanbo Hospital Management Group Limited,sbnk,创业板,SZSE,L,20230505,
2714,301296,新巨丰,山东,广告包装,山东新巨丰科技包装股份有限公司,"Shandong Newjf Technology Packaging Co., Ltd.",xjf,创业板,SZSE,L,20220902,
2715,301297,富乐德,安徽,半导体,安徽富乐德科技发展股份有限公司,"Ferrotec (An Hui) Technology Development Co., Ltd.",fld,创业板,SZSE,L,20221230,
2716,301298,东利机械,河北,汽车配件,保定市东利机械制造股份有限公司,"Baoding Dongli Machinery Co.,Ltd.",dljx,创业板,SZSE,L,20220606,
2717,301299,卓创资讯,山东,互联网,山东卓创资讯股份有限公司,"Sublime China Information Co.,Ltd.",zczx,创业板,SZSE,L,20221019,
2718,301300,远翔新材,福建,化工原料,福建远翔新材料股份有限公司,"Fujian Yuanxiang New Materials Co., Ltd.",yxxc,创业板,SZSE,L,20220819,
2719,301301,川宁生物,新疆,化学制药,伊犁川宁生物技术股份有限公司,"Yili Chuanning Biotechnology Co.,Ltd",cnsw,创业板,SZSE,L,20221227,
2720,301302,华如科技,北京,软件服务,北京华如科技股份有限公司,"Beijing Huaru Technology Co.,Ltd.",hrkj,创业板,SZSE,L,20220623,
2721,301303,真兰仪表,上海,电器仪表,上海真兰仪表科技股份有限公司,Zenner Metering Technology(Shanghai)Ltd.,zlyb,创业板,SZSE,L,20230220,
2722,301305,朗坤环境,深圳,环境保护,深圳市朗坤环境集团股份有限公司,Shenzhen Leoking Environmental Group Company Limited.,lkhj,创业板,SZSE,L,20230523,
2723,301306,西测测试,陕西,综合类,西安西测测试技术股份有限公司,"Xi'an Xice Testing Technology Co.,Ltd.",xccs,创业板,SZSE,L,20220726,
2724,301307,美利信,重庆,通信设备,重庆美利信科技股份有限公司,Chongqing Millison Technologies Inc.,mlx,创业板,SZSE,L,20230424,
2725,301308,江波龙,深圳,半导体,深圳市江波龙电子股份有限公司,"Shenzhen Longsys Electronics Co., Ltd.",jbl,创业板,SZSE,L,20220805,
2726,301309,万得凯,浙江,机械基件,浙江万得凯流体设备科技股份有限公司,"Zhejiang Wandekai Fluid Equipment Technology Co.,Ltd.",wdk,创业板,SZSE,L,20220919,
2727,301310,鑫宏业,江苏,汽车配件,无锡鑫宏业线缆科技股份有限公司,"Wuxi Xinhongye Wire&Cable Co., Ltd.",xhy,创业板,SZSE,L,20230602,
2728,301311,昆船智能,云南,机械基件,昆船智能技术股份有限公司,"Ksec Intelligent Technology Co.,Ltd.",kczn,创业板,SZSE,L,20221130,
2729,301312,智立方,深圳,专用机械,深圳市智立方自动化设备股份有限公司,"Shenzhen In-Cube Automation Co., Ltd.",zlf,创业板,SZSE,L,20220711,
2730,301313,凡拓数创,广东,文教休闲,广州凡拓数字创意科技股份有限公司,"Guangzhou Frontop Digital Creative Technology Co., Ltd.",ftsc,创业板,SZSE,L,20220930,
